{
  "kind": "adrf-finding",
  "adrf": "0.1",
  "caseId": "0xfe27fb74fca28790944155a2143216f238bf10d75af90998a9ae8396eda74101",
  "subQuestion": 1,
  "round": 1,
  "proposition": "0x2d8e3f52ac824ca6d665077925aae464860cc1996f5e9ce875725a2735c78f5b",
  "statement": "The version actually used for call 17 matches the committed version.",
  "value": "FALSE",
  "method": {
    "address": "0x0000000000000000000000000000000000000f03",
    "qType": "EVIDENCED",
    "version": "AttestorQuorumRule v0.1",
    "params": "0xc028c48c12d3031fbf5ce8e032eeba532b52b20da95920e4fc89d1942f533baf"
  },
  "inputs": {
    "description": "the service log and the response material of call 17, as provided under the evidence rule",
    "resultHash": "0xbd6697922926c3a6039fac33403bcddfde89e404a879c2df271454d2f6ff3836"
  },
  "dependsOn": [],
  "externalPremises": [
    "the service log provided is the log of call 17",
    "the panel attests honestly what it observed"
  ],
  "acceptedBy": "0x0000000000000000000000000000000000000f03",
  "supportKinds": [
    "signed",
    "evidenced"
  ],
  "reason": "NONE",
  "at": 1770090000
}
